{"$id":"https://example.org/schemas/auth_event.schema.json","$schema":"https://json-schema.org/draft/2020-12/schema","$title":"Authentication event","additionalProperties":true,"description":"Authentication and authorization events from RADIUS/NPS, 802.1X, and Microsoft Entra ID sign-in logs. Source-specific fields (authentication_method, policy_selected, assigned_vlan, radius_result) are kept because they carry authorization context that a generic schema would lose. This schema defines the telemetry source shape only; correlation and detection happen in an external SIEM. Never log shared secrets, passwords, tokens, or private key material.","properties":{"assigned_vlan":{"description":"Optional. VLAN assigned on success. Omit when authentication failed or no VLAN was assigned.","type":"integer"},"authentication_method":{"description":"Optional. Method used, for example EAP-TLS, PEAP-MSCHAPv2, or graph-signin-log for converted Entra records.","type":"string"},"authentication_result":{"description":"Required. Whether authentication succeeded.","enum":["success","failure"],"type":"string"},"correlation_id":{"description":"Optional. Opaque identifier for joining related events across sources.","type":"string"},"device_identity":{"description":"Optional. Device identity presented during authentication, for example a MAC address or certificate subject.","type":"string"},"event_type":{"const":"authentication","description":"Required. Fixed value for this event family.","type":"string"},"message":{"description":"Required. Human-readable summary. Must not contain secrets, passwords, tokens, or private key material.","type":"string"},"network_zone":{"description":"Optional. Zone label used for correlation.","type":"string"},"policy_selected":{"description":"Optional. The RADIUS network policy or Conditional Access policy that was evaluated.","type":"string"},"radius_result":{"description":"Optional. RADIUS result code. Use not-applicable for non-RADIUS sources such as Entra ID.","enum":["Access-Accept","Access-Reject","Access-Challenge","not-applicable"],"type":"string"},"severity":{"description":"Required. Severity assigned at the source.","enum":["low","medium","high","critical"],"type":"string"},"source":{"description":"Required. The authentication service or device that evaluated the request.","properties":{"device":{"description":"Optional. Device that generated the event, for example nps.example or entra-id.","type":"string"},"ip":{"description":"Required. IP address of the authentication service, or the client IP for cloud identity events.","type":"string"},"zone":{"description":"Optional. Network zone of the authentication service.","type":"string"}},"required":["ip"],"type":"object"},"timestamp":{"description":"Required. RFC3339 UTC timestamp of when the event occurred.","format":"date-time","type":"string"},"user_identity":{"description":"Optional. Human identity that attempted authentication, for example a UPN. Omit for machine-only authentications.","type":"string"},"vlan":{"description":"Optional. VLAN context of the request where known.","type":"integer"},"workload_identity":{"description":"Optional. Non-human workload identity where applicable.","type":"string"}},"required":["timestamp","event_type","severity","source","authentication_result","message"],"type":"object"}