{"authentication_method":"EAP-TLS","authentication_result":"failure","correlation_id":"radius-20260101-121000","device_identity":"00:11:22:33:44:55","event_type":"authentication","message":"RADIUS rejected authentication for contractor device; no VLAN assigned","network_zone":"GUEST","policy_selected":"Contractor-Device-Policy","radius_result":"Access-Reject","severity":"medium","source":{"device":"nps.example","ip":"10.99.0.20","zone":"MANAGEMENT"},"timestamp":"2026-01-01T12:10:00Z","user_identity":"contractor@example.com"}